{
  "$schema": "https://json-schema.org/draft/2020-12/schema",
  "$id": "trader1.upbit_paper_post_rerun_current_evidence_promotion_guard_report.v1",
  "title": "upbit_paper_post_rerun_current_evidence_promotion_guard_report",
  "type": "object",
  "additionalProperties": false,
  "required": [
    "schema_id",
    "generated_at_utc",
    "project_id",
    "promotion_guard_id",
    "exchange",
    "market_type",
    "mode",
    "session_id",
    "truth_role",
    "source_post_rerun_reconciliation_path",
    "source_post_rerun_reconciliation_hash",
    "source_post_rerun_reconciliation_file_load_status",
    "source_post_rerun_reconciliation_file_hash",
    "source_post_rerun_reconciliation_file_recomputed_hash",
    "source_post_rerun_reconciliation_file_hash_match",
    "source_post_rerun_ledger_rollup_status",
    "source_post_rerun_reconciliation_status",
    "source_primary_blocker_code",
    "source_candidate_item_count",
    "source_candidate_rollup_pass_count",
    "candidate_item_count",
    "candidate_rollup_verified_count",
    "candidate_rollup_hash_mismatch_count",
    "candidate_rollup_scope_mismatch_count",
    "promotion_review_ready_count",
    "promotion_review_blocked_count",
    "current_evidence_write_allowed_count",
    "candidate_current_evidence_usable_count",
    "candidate_current_evidence_blocked_count",
    "promotion_guard_status",
    "primary_blocker_code",
    "blocker_codes",
    "items",
    "operator_next_action",
    "current_evidence_mutation_allowed",
    "current_evidence_write_allowed",
    "current_ledger_jsonl_write_allowed",
    "latest_runtime_pointer_write_allowed",
    "persistent_loop_mutation_allowed",
    "source_delete_allowed",
    "actual_rerun_executed",
    "actual_long_run_evidence_created",
    "long_run_evidence_eligible",
    "promotion_eligible",
    "credential_load_attempted",
    "private_endpoint_called",
    "order_endpoint_called",
    "order_adapter_called",
    "live_key_loaded",
    "live_order_ready",
    "live_order_allowed",
    "can_live_trade",
    "scale_up_allowed",
    "promotion_guard_hash"
  ],
  "properties": {
    "schema_id": {"const": "trader1.upbit_paper_post_rerun_current_evidence_promotion_guard_report.v1"},
    "generated_at_utc": {"type": "string", "minLength": 20},
    "project_id": {"const": "TRADER_1"},
    "promotion_guard_id": {"type": "string", "minLength": 1},
    "exchange": {"const": "UPBIT"},
    "market_type": {"const": "KRW_SPOT"},
    "mode": {"const": "PAPER"},
    "session_id": {"type": "string", "minLength": 1},
    "truth_role": {"const": "PAPER_RUNTIME_POST_RERUN_CURRENT_EVIDENCE_PROMOTION_GUARD_REVIEW_ONLY_NOT_WRITER"},
    "source_post_rerun_reconciliation_path": {"type": "string", "minLength": 1},
    "source_post_rerun_reconciliation_hash": {"type": "string", "minLength": 64, "maxLength": 64},
    "source_post_rerun_reconciliation_file_load_status": {
      "enum": ["PASS", "MISSING", "INVALID_UTF8", "INVALID_JSON", "NOT_OBJECT", "HASH_MISMATCH", "UNKNOWN"]
    },
    "source_post_rerun_reconciliation_file_hash": {"type": ["string", "null"], "minLength": 64, "maxLength": 64},
    "source_post_rerun_reconciliation_file_recomputed_hash": {"type": ["string", "null"], "minLength": 64, "maxLength": 64},
    "source_post_rerun_reconciliation_file_hash_match": {"type": "boolean"},
    "source_post_rerun_ledger_rollup_status": {"const": "PASS"},
    "source_post_rerun_reconciliation_status": {"const": "BLOCKED"},
    "source_primary_blocker_code": {"const": "POST_RERUN_RECONCILIATION_REQUIRED"},
    "source_candidate_item_count": {"type": "integer", "minimum": 0},
    "source_candidate_rollup_pass_count": {"type": "integer", "minimum": 0},
    "candidate_item_count": {"type": "integer", "minimum": 0},
    "candidate_rollup_verified_count": {"type": "integer", "minimum": 0},
    "candidate_rollup_hash_mismatch_count": {"type": "integer", "minimum": 0},
    "candidate_rollup_scope_mismatch_count": {"type": "integer", "minimum": 0},
    "promotion_review_ready_count": {"type": "integer", "minimum": 0},
    "promotion_review_blocked_count": {"type": "integer", "minimum": 0},
    "current_evidence_write_allowed_count": {"const": 0},
    "candidate_current_evidence_usable_count": {"const": 0},
    "candidate_current_evidence_blocked_count": {"type": "integer", "minimum": 0},
    "promotion_guard_status": {"const": "BLOCKED"},
    "primary_blocker_code": {"const": "POST_RERUN_RECONCILIATION_REQUIRED"},
    "blocker_codes": {"type": "array", "items": {"type": "string"}, "minItems": 1, "uniqueItems": true},
    "items": {
      "type": "array",
      "items": {
        "type": "object",
        "additionalProperties": false,
        "required": [
          "replacement_loop_id",
          "cycle_id",
          "source_candidate_classification",
          "source_item_blocker_code",
          "candidate_rollup_artifact_path",
          "candidate_rollup_load_status",
          "candidate_rollup_path_scope_status",
          "candidate_rollup_role",
          "source_candidate_rollup_hash",
          "candidate_rollup_hash",
          "candidate_rollup_recomputed_hash",
          "candidate_rollup_hash_self_check",
          "candidate_rollup_status",
          "candidate_ledger_jsonl_count",
          "candidate_ledger_event_count",
          "candidate_filled_order_count",
          "candidate_empty_no_trade_ledger",
          "staged_runtime_cycle_path",
          "staged_ledger_jsonl_path",
          "staged_writer_report_path",
          "staged_artifact_scope_status",
          "planned_current_ledger_jsonl_path",
          "planned_current_ledger_path_scope_status",
          "candidate_rollup_verified",
          "promotion_review_ready",
          "promotion_review_status",
          "item_blocker_code",
          "recommended_operator_action",
          "candidate_rollup",
          "candidate_current_evidence_usable",
          "current_evidence_write_allowed",
          "current_evidence_mutation_allowed",
          "current_ledger_jsonl_write_allowed",
          "latest_runtime_pointer_write_allowed",
          "persistent_loop_mutation_allowed",
          "source_delete_allowed",
          "actual_long_run_evidence_created",
          "long_run_evidence_eligible",
          "promotion_eligible",
          "live_permission_created",
          "live_order_ready",
          "live_order_allowed",
          "can_live_trade",
          "scale_up_allowed"
        ],
        "properties": {
          "replacement_loop_id": {"type": "string", "minLength": 1},
          "cycle_id": {"type": "string", "minLength": 1},
          "source_candidate_classification": {"type": "string", "minLength": 1},
          "source_item_blocker_code": {"type": ["string", "null"]},
          "candidate_rollup_artifact_path": {"type": "string", "minLength": 1},
          "candidate_rollup_load_status": {"type": "string", "minLength": 1},
          "candidate_rollup_path_scope_status": {"enum": ["MATCH", "MISMATCH"]},
          "candidate_rollup_role": {"type": ["string", "null"]},
          "source_candidate_rollup_hash": {"type": ["string", "null"], "minLength": 64, "maxLength": 64},
          "candidate_rollup_hash": {"type": ["string", "null"], "minLength": 64, "maxLength": 64},
          "candidate_rollup_recomputed_hash": {"type": ["string", "null"], "minLength": 64, "maxLength": 64},
          "candidate_rollup_hash_self_check": {"enum": ["PASS", "FAIL"]},
          "candidate_rollup_status": {"type": ["string", "null"]},
          "candidate_ledger_jsonl_count": {"type": ["integer", "null"], "minimum": 0},
          "candidate_ledger_event_count": {"type": ["integer", "null"], "minimum": 0},
          "candidate_filled_order_count": {"type": ["integer", "null"], "minimum": 0},
          "candidate_empty_no_trade_ledger": {"type": "boolean"},
          "staged_runtime_cycle_path": {"type": "string"},
          "staged_ledger_jsonl_path": {"type": "string"},
          "staged_writer_report_path": {"type": "string"},
          "staged_artifact_scope_status": {"enum": ["MATCH", "MISMATCH"]},
          "planned_current_ledger_jsonl_path": {"type": "string", "minLength": 1},
          "planned_current_ledger_path_scope_status": {"enum": ["MATCH", "MISMATCH"]},
          "candidate_rollup_verified": {"type": "boolean"},
          "promotion_review_ready": {"type": "boolean"},
          "promotion_review_status": {
            "enum": [
              "REVIEW_READY_WRITE_BLOCKED",
              "BLOCKED_SCOPE_MISMATCH",
              "BLOCKED_HASH_MISMATCH",
              "BLOCKED_CANDIDATE_VALIDATION"
            ]
          },
          "item_blocker_code": {"type": "string", "minLength": 1},
          "recommended_operator_action": {"type": "string", "minLength": 1},
          "candidate_rollup": {"type": "object"},
          "candidate_current_evidence_usable": {"const": false},
          "current_evidence_write_allowed": {"const": false},
          "current_evidence_mutation_allowed": {"const": false},
          "current_ledger_jsonl_write_allowed": {"const": false},
          "latest_runtime_pointer_write_allowed": {"const": false},
          "persistent_loop_mutation_allowed": {"const": false},
          "source_delete_allowed": {"const": false},
          "actual_long_run_evidence_created": {"const": false},
          "long_run_evidence_eligible": {"const": false},
          "promotion_eligible": {"const": false},
          "live_permission_created": {"const": false},
          "live_order_ready": {"const": false},
          "live_order_allowed": {"const": false},
          "can_live_trade": {"const": false},
          "scale_up_allowed": {"const": false}
        }
      }
    },
    "operator_next_action": {"type": "string", "minLength": 1},
    "current_evidence_mutation_allowed": {"const": false},
    "current_evidence_write_allowed": {"const": false},
    "current_ledger_jsonl_write_allowed": {"const": false},
    "latest_runtime_pointer_write_allowed": {"const": false},
    "persistent_loop_mutation_allowed": {"const": false},
    "source_delete_allowed": {"const": false},
    "actual_rerun_executed": {"const": false},
    "actual_long_run_evidence_created": {"const": false},
    "long_run_evidence_eligible": {"const": false},
    "promotion_eligible": {"const": false},
    "credential_load_attempted": {"const": false},
    "private_endpoint_called": {"const": false},
    "order_endpoint_called": {"const": false},
    "order_adapter_called": {"const": false},
    "live_key_loaded": {"const": false},
    "live_order_ready": {"const": false},
    "live_order_allowed": {"const": false},
    "can_live_trade": {"const": false},
    "scale_up_allowed": {"const": false},
    "promotion_guard_hash": {"type": "string", "minLength": 64, "maxLength": 64}
  }
}
