{
  "actual_long_run_evidence_created": false,
  "actual_rerun_executed": false,
  "blocker_codes": [
    "ACTUAL_LONG_RUN_RUNTIME_EVIDENCE_MISSING",
    "LIVE_READY_MISSING",
    "POST_RERUN_CURRENT_EVIDENCE_WRITE_BLOCKED",
    "POST_RERUN_RECONCILIATION_REQUIRED",
    "SCALE_UP_NOT_ELIGIBLE"
  ],
  "can_live_trade": false,
  "candidate_current_evidence_blocked_count": 8,
  "candidate_current_evidence_usable_count": 0,
  "candidate_item_count": 8,
  "candidate_rollup_hash_mismatch_count": 0,
  "candidate_rollup_scope_mismatch_count": 0,
  "candidate_rollup_verified_count": 8,
  "credential_load_attempted": false,
  "current_evidence_mutation_allowed": false,
  "current_evidence_write_allowed": false,
  "current_evidence_write_allowed_count": 0,
  "current_ledger_jsonl_write_allowed": false,
  "exchange": "UPBIT",
  "generated_at_utc": "2026-05-01T19:39:14Z",
  "items": [
    {
      "actual_long_run_evidence_created": false,
      "can_live_trade": false,
      "candidate_current_evidence_usable": false,
      "candidate_empty_no_trade_ledger": false,
      "candidate_filled_order_count": 1,
      "candidate_ledger_event_count": 6,
      "candidate_ledger_jsonl_count": 1,
      "candidate_rollup": {
        "actual_long_run_evidence_created": false,
        "blockers": [],
        "can_live_trade": false,
        "candidate_artifact_is_current_evidence": false,
        "candidate_current_evidence_usable": false,
        "candidate_rollup_artifact_path": "system/runtime/upbit/krw_spot/paper/mvp1_upbit_paper_launcher/paper_runtime/rerun_candidates_post_rollup/mvp4-candidate-linkage-cost-model-regenerated-current-schema/mvp4-candidate-linkage-cost-model-cycle-1.ledger_rollup_candidate.json",
        "candidate_rollup_hash": "B628C1CDD9DFBC8768FCC982AA57C559F83CC4AD3B45921FBF69A19466CFF826",
        "candidate_rollup_role": "PAPER_RERUN_CANDIDATE_LEDGER_ROLLUP_NOT_CURRENT_EVIDENCE",
        "candidate_rollup_status": "PASS",
        "current_evidence_mutation_allowed": false,
        "current_ledger_jsonl_write_allowed": false,
        "cycle_id": "mvp4-candidate-linkage-cost-model-cycle-1",
        "display_only": true,
        "empty_no_trade_ledger": false,
        "exchange": "UPBIT",
        "filled_order_count": 1,
        "final_decision": "ENTER_LONG",
        "generated_at_utc": "2026-05-01T15:16:17Z",
        "latest_ledger_head_hash": "0401E224A668F2D19B4EF02D242523E8CA7DCF981E924855029191EAF00F13D2",
        "latest_runtime_pointer_write_allowed": false,
        "ledger_event_count": 6,
        "ledger_jsonl_count": 1,
        "live_order_allowed": false,
        "live_order_ready": false,
        "long_run_evidence_eligible": false,
        "market_type": "KRW_SPOT",
        "mode": "PAPER",
        "paper_only": true,
        "persistent_loop_mutation_allowed": false,
        "primary_blocker_code": null,
        "project_id": "TRADER_1",
        "promotion_eligible": false,
        "replacement_loop_id": "mvp4-candidate-linkage-cost-model-regenerated-current-schema",
        "scale_up_allowed": false,
        "session_id": "mvp1_upbit_paper_launcher",
        "source_delete_allowed": false,
        "source_staging_executor_hash": "0EBF0FACF25DBFF0F041786EDEB57A841B239B896A7581A09C7132C381570C09",
        "source_staging_executor_item_status": "REUSED_EXISTING",
        "staged_ledger_jsonl_path": "system/runtime/upbit/krw_spot/paper/mvp1_upbit_paper_launcher/paper_runtime/rerun_candidates/mvp4-candidate-linkage-cost-model-regenerated-current-schema/mvp4-candidate-linkage-cost-model-cycle-1.paper_ledger_events.jsonl",
        "staged_runtime_cycle_hash": "CD61A0CF8F9C88FA2AA7209AEF3298674704EEEA69977DFA410D0AF3A7F8A4A8",
        "staged_runtime_cycle_path": "system/runtime/upbit/krw_spot/paper/mvp1_upbit_paper_launcher/paper_runtime/rerun_candidates/mvp4-candidate-linkage-cost-model-regenerated-current-schema/mvp4-candidate-linkage-cost-model-cycle-1.runtime_cycle.json",
        "staged_writer_report_path": "system/runtime/upbit/krw_spot/paper/mvp1_upbit_paper_launcher/paper_runtime/rerun_candidates/mvp4-candidate-linkage-cost-model-regenerated-current-schema/mvp4-candidate-linkage-cost-model-cycle-1.writer_report.json"
      },
      "candidate_rollup_artifact_path": "system/runtime/upbit/krw_spot/paper/mvp1_upbit_paper_launcher/paper_runtime/rerun_candidates_post_rollup/mvp4-candidate-linkage-cost-model-regenerated-current-schema/mvp4-candidate-linkage-cost-model-cycle-1.ledger_rollup_candidate.json",
      "candidate_rollup_hash": "B628C1CDD9DFBC8768FCC982AA57C559F83CC4AD3B45921FBF69A19466CFF826",
      "candidate_rollup_hash_self_check": "PASS",
      "candidate_rollup_load_status": "PASS",
      "candidate_rollup_path_scope_status": "MATCH",
      "candidate_rollup_recomputed_hash": "B628C1CDD9DFBC8768FCC982AA57C559F83CC4AD3B45921FBF69A19466CFF826",
      "candidate_rollup_role": "PAPER_RERUN_CANDIDATE_LEDGER_ROLLUP_NOT_CURRENT_EVIDENCE",
      "candidate_rollup_status": "PASS",
      "candidate_rollup_verified": true,
      "current_evidence_mutation_allowed": false,
      "current_evidence_write_allowed": false,
      "current_ledger_jsonl_write_allowed": false,
      "cycle_id": "mvp4-candidate-linkage-cost-model-cycle-1",
      "item_blocker_code": "POST_RERUN_RECONCILIATION_REQUIRED",
      "latest_runtime_pointer_write_allowed": false,
      "live_order_allowed": false,
      "live_order_ready": false,
      "live_permission_created": false,
      "long_run_evidence_eligible": false,
      "persistent_loop_mutation_allowed": false,
      "planned_current_ledger_jsonl_path": "system/runtime/upbit/krw_spot/paper/mvp1_upbit_paper_launcher/ledger/cycles/mvp4-candidate-linkage-cost-model-cycle-1.paper_ledger_events.jsonl",
      "planned_current_ledger_path_scope_status": "MATCH",
      "promotion_eligible": false,
      "promotion_review_ready": true,
      "promotion_review_status": "REVIEW_READY_WRITE_BLOCKED",
      "recommended_operator_action": "Do not write current evidence in this guard. Use a separate reviewed writer patch only if policy explicitly permits PAPER current-evidence mutation.",
      "replacement_loop_id": "mvp4-candidate-linkage-cost-model-regenerated-current-schema",
      "scale_up_allowed": false,
      "source_candidate_classification": "RERUN_CANDIDATE_LEDGER_ROLLUP_PASS_CURRENT_EVIDENCE_BLOCKED",
      "source_candidate_rollup_hash": "B628C1CDD9DFBC8768FCC982AA57C559F83CC4AD3B45921FBF69A19466CFF826",
      "source_delete_allowed": false,
      "source_item_blocker_code": "POST_RERUN_RECONCILIATION_REQUIRED",
      "staged_artifact_scope_status": "MATCH",
      "staged_ledger_jsonl_path": "system/runtime/upbit/krw_spot/paper/mvp1_upbit_paper_launcher/paper_runtime/rerun_candidates/mvp4-candidate-linkage-cost-model-regenerated-current-schema/mvp4-candidate-linkage-cost-model-cycle-1.paper_ledger_events.jsonl",
      "staged_runtime_cycle_path": "system/runtime/upbit/krw_spot/paper/mvp1_upbit_paper_launcher/paper_runtime/rerun_candidates/mvp4-candidate-linkage-cost-model-regenerated-current-schema/mvp4-candidate-linkage-cost-model-cycle-1.runtime_cycle.json",
      "staged_writer_report_path": "system/runtime/upbit/krw_spot/paper/mvp1_upbit_paper_launcher/paper_runtime/rerun_candidates/mvp4-candidate-linkage-cost-model-regenerated-current-schema/mvp4-candidate-linkage-cost-model-cycle-1.writer_report.json"
    },
    {
      "actual_long_run_evidence_created": false,
      "can_live_trade": false,
      "candidate_current_evidence_usable": false,
      "candidate_empty_no_trade_ledger": false,
      "candidate_filled_order_count": 1,
      "candidate_ledger_event_count": 6,
      "candidate_ledger_jsonl_count": 1,
      "candidate_rollup": {
        "actual_long_run_evidence_created": false,
        "blockers": [],
        "can_live_trade": false,
        "candidate_artifact_is_current_evidence": false,
        "candidate_current_evidence_usable": false,
        "candidate_rollup_artifact_path": "system/runtime/upbit/krw_spot/paper/mvp1_upbit_paper_launcher/paper_runtime/rerun_candidates_post_rollup/mvp4-candidate-linkage-cost-model-regenerated-current-schema/mvp4-candidate-linkage-cost-model-cycle-2.ledger_rollup_candidate.json",
        "candidate_rollup_hash": "2B4B9B2EE5EEA12E5DDE49255560E4F37E96E240F937974B31AEB50AC3152AA7",
        "candidate_rollup_role": "PAPER_RERUN_CANDIDATE_LEDGER_ROLLUP_NOT_CURRENT_EVIDENCE",
        "candidate_rollup_status": "PASS",
        "current_evidence_mutation_allowed": false,
        "current_ledger_jsonl_write_allowed": false,
        "cycle_id": "mvp4-candidate-linkage-cost-model-cycle-2",
        "display_only": true,
        "empty_no_trade_ledger": false,
        "exchange": "UPBIT",
        "filled_order_count": 1,
        "final_decision": "ENTER_LONG",
        "generated_at_utc": "2026-05-01T15:16:17Z",
        "latest_ledger_head_hash": "D6AAF71F12A7BF9ECF6DB20FBB76D542209E3362599452A2EB971F7DEEDBF1A9",
        "latest_runtime_pointer_write_allowed": false,
        "ledger_event_count": 6,
        "ledger_jsonl_count": 1,
        "live_order_allowed": false,
        "live_order_ready": false,
        "long_run_evidence_eligible": false,
        "market_type": "KRW_SPOT",
        "mode": "PAPER",
        "paper_only": true,
        "persistent_loop_mutation_allowed": false,
        "primary_blocker_code": null,
        "project_id": "TRADER_1",
        "promotion_eligible": false,
        "replacement_loop_id": "mvp4-candidate-linkage-cost-model-regenerated-current-schema",
        "scale_up_allowed": false,
        "session_id": "mvp1_upbit_paper_launcher",
        "source_delete_allowed": false,
        "source_staging_executor_hash": "0EBF0FACF25DBFF0F041786EDEB57A841B239B896A7581A09C7132C381570C09",
        "source_staging_executor_item_status": "REUSED_EXISTING",